answers,marks
"Subnetting is the practice of partitioning a large IP network into smaller, more manageable sections. It's important in IP addressing because it helps reduce IP address wastage, improves network efficiency, and allows for better network organization.",4
" IPv4 and IPv6 are both IP address formats, but they differ in address length. IPv4 uses 32-bit addresses, while IPv6 uses 128-bit addresses. IPv6 is growing in importance as IPv4 addresses become scarce, offering a larger pool of addresses to accommodate the increasing number of internet-connected devices.",5
" DNS is a service that translates human-readable domain names (e.g., www.example.com) into IP addresses (e.g., 203.0.113.1). It's critical for the internet because it simplifies how we access websites, making it easy for users to find and interact with online resources.",5
,0
" VPN, or Virtual Private Network, is a technology that encrypts network traffic and creates a secure tunnel over a public network. It's used to secure network communications, especially when accessing the internet from untrusted networks, by protecting data and ensuring privacy.",4.5
"TCP is a connection-oriented protocol that guarantees data delivery, making it ideal for applications where data integrity is critical, like file transfers. UDP, being connectionless, is better for real-time applications like live streaming and online gaming, where low latency is more important than guaranteed delivery.",5
,0
"Network topologies determine the physical or logical layout of a network. Common examples include the bus topology, where devices are connected in a linear sequence, the star topology with a central hub, and the tree topology, which is a combination of multiple star topologies.",4
"A firewall is a security tool that safeguards a computer network from external threats. It examines network traffic, applying rules to either permit or block data packets, thus preventing unauthorized access and protecting the network from malicious activities.",5
"A network administrator is responsible for the efficient operation of computer networks. They configure and maintain network devices, monitor performance, troubleshoot connectivity problems, manage user accounts and access permissions, and enforce security measures to protect the network from threats.",5
"Quality of Service (QoS) is critical for enhancing network performance by prioritizing specific traffic. It becomes crucial in situations where real-time applications like video conferencing, VoIP, and live streaming require low latency and uninterrupted data flow for a satisfactory user experience.",5
" A packet-switched network segments data into packets that travel independently to the destination. This is unlike a circuit-switched network, which establishes a dedicated path for the entire call. Packet-switched networks are more versatile and efficient for data transmission, while circuit-switched networks are typical for voice calls.",5
"Designing a network for a large organization or data center requires careful consideration of scalability, redundancy, security, high-speed data connections, and effective network management and monitoring tools to ensure optimal performance and reliability.",5
" MAC addresses are hardware-based identifiers used for local communication within a network. Unlike IP addresses, which are logical and used for global data routing, MAC addresses are specific to a device's network interface and help devices recognize and communicate with each other within the same network.",5
Bandwidth in networking signifies the maximum data capacity a network can handle. It affects data transmission by defining how much data can be transmitted in a given time frame. Higher bandwidth networks facilitate faster data transmission and support bandwidth-intensive tasks like video streaming.,5
"A proxy server is a server that acts as an intermediary between a user's device and the internet. It plays a critical role in network security and privacy by hiding the user's IP address and filtering web traffic. Additionally, it can cache data, leading to faster web browsing.",5
"A VLAN, or Virtual Local Area Network, is a logical network segment within a physical network. It is used in network design to improve security, optimize network traffic, and simplify network management. VLANs enable different groups of devices to exist on separate networks while sharing the same underlying infrastructure.",5
" Network routers and switches serve distinct purposes in a network. Routers are responsible for connecting different networks, determining how data should move between them. Switches, in contrast, connect devices within the same network, ensuring data is correctly directed to its destination. Routers operate at the network layer (Layer 3), while switches function at the data link layer (Layer 2).",5
"Latency is a critical aspect of network performance, especially for real-time applications such as video conferencing and online gaming. High latency can result in delays, negatively impacting video and audio quality and causing lag in games. Low latency is crucial for a seamless and responsive user experience in these applications.",5
" Load balancing in network design involves spreading network traffic across multiple servers or paths to avoid congestion and maximize performance. The advantages include enhanced network efficiency, improved reliability, and the ability to scale resources to meet increasing demands.",5
"A DNS resolver is an essential part of the DNS system that translates domain names into IP addresses. It works by querying DNS servers to retrieve the IP address corresponding to a domain name entered by a user, enabling the device to establish a connection with the desired website.",5
"Network administrators are responsible for ensuring the efficient operation of computer networks. They configure and maintain network devices, monitor performance, troubleshoot connectivity problems, manage user accounts and access permissions, and enforce security measures to protect the network from threats.",5
"Quality of Service (QoS) plays a critical role in network performance by prioritizing specific types of network traffic. It is crucial in situations where real-time applications like video conferencing, VoIP, and live streaming demand low latency and uninterrupted data flow for a satisfactory user experience. QoS ensures that these applications receive the priority they require.",5
"A firewall is a security tool that safeguards a computer network from external threats. It examines network traffic, applying rules to either permit or block data packets, thus preventing unauthorized access and protecting the network from malicious activities.",5
"Wireless networking, or Wi-Fi, enables devices to connect to a network without physical cables, using radio waves. To secure wireless networks, encryption methods like WPA3 and WPA2 are used to encode data during transmission, safeguarding it from unauthorized access.",5
"Designing a network for a large organization or data center requires careful consideration of scalability, redundancy, security, high-speed data connections, and effective network management and monitoring tools to ensure optimal performance and reliability.",5
A subnet mask is a numerical code in IP addressing that separates the network and host components of an IP address. It influences IP address allocation by specifying which part of the address denotes the network and which part denotes the host. This allows for efficient IP address utilization and network segmentation.,5
"A DMZ, or Demilitarized Zone, is a network segment placed between the internal network and an external network, such as the internet. It is important in network security because it enables external-facing services, like email and web servers, to function in an isolated environment, protecting the internal network from direct exposure to potential threats.",5
"A Man-in-the-Middle (MitM) attack is a cyberattack in which an attacker covertly intercepts and potentially modifies communication between two parties. To prevent it, strong encryption, digital certificates, and secure communication protocols should be employed to safeguard data integrity and confidentiality.",5
"Network virtualization entails establishing multiple virtual networks on a single physical network infrastructure. It offers advantages for data centers and cloud computing, such as optimizing resource utilization, enhancing flexibility, and providing isolation. Network virtualization streamlines network management and scalability.",5
"A network protocol analyzer, or packet sniffer, is a tool for capturing and inspecting network traffic. It is useful in network troubleshooting and monitoring to diagnose network issues, locate performance bottlenecks, and analyze network behavior. It is an essential tool for understanding and resolving network problems.",5
"A network gateway functions as a bridge between different network segments, allowing data to flow between them. It serves as a translator, ensuring that networks with different protocols or addressing schemes can communicate effectively. The gateway's significance lies in its role as a connector that promotes smooth data exchange.

",5
" Wireless mesh networks have benefits including scalability, flexibility, and redundancy. They can easily expand to cover larger areas and adapt to changing conditions. Challenges include higher initial setup costs, potential interference, and the complexity of managing the network's routing.",5
"A load balancer plays a vital role in a web server farm by evenly distributing incoming web traffic among multiple servers. This distribution enhances performance by preventing server overload. In terms of fault tolerance, if one server experiences issues, the load balancer reroutes traffic to other servers, minimizing downtime and ensuring continuous service.",5
"Symmetric encryption uses a single key for both encryption and decryption, which makes it faster but necessitates secure key exchange. It is ideal for secure data transfer within a closed system. Asymmetric encryption uses a key pair (public and private) and is suitable for secure communication over open networks, as in secure email communication or secure web browsing.",5
"A content delivery network (CDN) consists of a network of servers located across the globe, storing and delivering web content. Its significance is in enhancing the speed and availability of web content globally. CDNs reduce latency by serving content from servers in proximity to the user, resulting in faster load times. They also bolster content availability by sharing the load, ensuring consistent content delivery even during high traffic periods.",5
"A network switch is an intelligent device that forwards data based on MAC addresses, increasing network efficiency and security. A network hub, in contrast, broadcasts data to all connected devices without intelligence. Switches offer advantages like faster data transfer, reduced network collisions, and enhanced security in modern network environments.",5
"OOP is a programming paradigm that structures software using objects, which are instances of classes. It's important as it promotes modularity, reusability, and easier maintenance of code.",5
"The four principles are: Encapsulation (data hiding), Inheritance (reusing and extending classes), Polymorphism (multiple behaviors for objects of the same type), and Abstraction (modeling real-world entities).",4.5
"A class is a blueprint or template for creating objects, while an object is an instance of a class with its own state and behavior.",5
"A class is a blueprint, and an object is an instance of that blueprint. Multiple objects can be created from a single class.",3.5
Encapsulation is the practice of hiding the internal details of an object and providing a controlled interface to interact with it.,3.5
"Encapsulation prevents direct access to an object's internal state, allowing data to be modified only through controlled methods, thus maintaining data integrity.",3.5
"Inheritance allows a new class (subclass/derived) to inherit properties and behaviors from an existing class (superclass/base). Example: A ""Car"" class can inherit from a ""Vehicle"" class.",4.5
"Inheritance promotes code reuse, hierarchical organization, and the ability to model relationships between classes.",4.5
"Private' makes class members accessible only within the class they are defined in, ensuring encapsulation.",4.5
"Polymorphism allows objects of different classes to be treated as objects of a common superclass. Example: A ""Shape"" superclass can have subclasses like ""Circle"" and ""Square,"" both with a ""calculateArea"" method.",4.5
Abstract classes cannot be instantiated and serve as blueprints for other classes. They are used to define a common interface for subclasses and enforce method implementations.,4.5
Method overloading is having multiple methods in the same class with different parameters. Method overriding is redefining a method in a subclass with the same signature as the superclass.,4.5
"OOP achieves code reusability through inheritance and composition, allowing classes to inherit or contain attributes and behaviors from other classes.",4.5
"Composition involves creating objects of other classes as attributes within a class, while inheritance is about creating a new class based on an existing class.",3.5
A constructor is a special method used for initializing objects when they are created. It sets initial values and allocates resources.,3
"A destructor is a method used to release resources and clean up an object. It's called when an object is no longer in use, typically when it goes out of scope.",3.5
"Static methods and variables belong to a class, not an instance. They can be called without creating an object and are often used for utility functions.",4
super' is used to call a superclass's methods or constructors from a subclass. It's used when you want to extend the functionality of the superclass.,4
"this' refers to the current object's instance, while 'super' refers to the superclass. 'this' is used for disambiguation or to access instance members.",4
"Multiple inheritance allows a class to inherit from multiple superclasses. The diamond problem occurs when a class inherits from two classes with a common method or attribute, creating ambiguity.",4
"SOLID is an acronym for Single Responsibility, Open-Closed, Liskov Substitution, Interface Segregation, and Dependency Inversion. These principles guide good software design and maintainability.",4
"An abstract class can have both defined and undefined methods, while an interface contains only method signatures. A class can implement multiple interfaces but inherit from only one class.",4.5
"Method chaining allows invoking multiple methods on an object in a single line, which is possible when methods return the object itself. It enhances code readability.",4.5
OOP allows encapsulating data and providing controlled access to it. The internal state of an object is hidden from external manipulation.,4.5
"A shallow copy duplicates the object's references but not the referenced objects themselves. A deep copy duplicates the object and all objects it references, recursively.",4.5
"A design pattern is a reusable solution to a common problem in software design. They are used to promote best practices, increase code quality, and solve recurring issues efficiently.",3.5
The Observer pattern allows objects to subscribe and receive updates from a subject when its state changes. A real-world example is a weather station that notifies multiple display devices when weather conditions change.,4.5
"The Singleton pattern ensures that a class has only one instance and provides a global point of access. It is useful when you need to control access to a single resource, like a database connection.",3.5
The Factory Method pattern defines an interface for creating objects but lets subclasses decide which class to instantiate. It's useful for creating objects without specifying the exact class.,4.5
"The 'final' keyword is used to indicate that a class, method, or variable cannot be further extended or overridden. It's often used to prevent modification or extension in certain cases.",3.5
"The ""superclass"" and ""subclass"" relationship in OOP is a fundamental concept that's also known as inheritance. The superclass (or base class) is a class that provides attributes and methods to other classes, known as subclasses (or derived classes). Subclasses inherit the properties and behaviors of the superclass, which allows for code reuse and the creation of specialized classes. This relationship is often referred to as an ""is-a"" relationship, where a subclass is a more specific version of the superclass.",2.5
"""Polymorphism"" is a key concept in OOP that allows objects of different classes to be treated as objects of a common base class. It promotes flexibility and reusability in code design. A practical example of polymorphism is creating a method that can accept different types of objects as parameters, and the method behaves differently based on the actual type of the object it receives.",4
"OOP handles ""method overriding"" when a subclass provides a specific implementation for a method that's already defined in its superclass. This allows the subclass to customize the behavior of the inherited method. Method overriding is particularly useful when you want to create more specialized behavior for a method in a subclass while preserving the method's name and signature from the superclass.",4.5
"""Interfaces"" in OOP define a contract that specifies a set of methods that must be implemented by any class that implements the interface. Interfaces are used to ensure that specific behaviors are available in classes that implement them. They are different from abstract classes in that a class can implement multiple interfaces, promoting flexibility and reusability.",4
"""Method visibility"" in OOP refers to the accessibility of methods. There are three common visibility modifiers: ""public"" (accessible from anywhere), ""private"" (only accessible within the class), and ""protected"" (accessible within the class and its subclasses). These modifiers control how methods can be accessed and play a role in encapsulation and data protection.",5
"A ""constructor"" in OOP is a special method used to initialize objects of a class. It's automatically called when an object is created, and its purpose is to set initial values for the object's attributes. Constructors are essential in OOP to ensure that objects start with a consistent and valid state.",4.5
"OOP typically doesn't support ""multiple inheritance,"" where a class can inherit from multiple superclasses. This is because it can lead to the ""diamond problem"" and code complexity. Many OOP languages use interfaces to provide a form of multiple inheritance, allowing a class to implement multiple interfaces without inheriting from multiple classes.",4.5
"""Aggregation"" and ""composition"" are used in OOP to represent relationships between objects. Aggregation implies a ""has-a"" relationship, where one class contains another class as a part, but the contained class can exist independently. Composition implies a stronger ownership, where one class is composed of another, and the contained class cannot exist without the container.",4.5
"""Method chaining"" is a technique in OOP where methods return the object itself, allowing multiple methods to be chained together in a single line of code. It improves code readability by providing a fluent and concise way to perform a sequence of operations on an object.",4.5
"""Tight coupling"" and ""loose coupling"" refer to the degree of dependency between components or classes in a system. Tight coupling means that components are highly dependent on each other, and changes in one component can have a significant impact on others. In contrast, loose coupling means that components are more independent and can be changed or replaced with minimal impact on other components. OOP promotes loose coupling, which enhances code maintainability and flexibility.",4.5
"ER-modeling is a data modeling technique used in software engineering to produce a conceptual data model of a information system. Diagrams created using this ER-modeling technique are called Entity-Relationship Diagrams, or ER diagrams or ERDs. So you can say that Entity Relationship Diagrams illustrate the logical structure of databases.",3
"Normalization is the process of efficiently organizing data in a database. There are two goals of the normalization process: eliminating redundant data (for example, storing the same data in more than one table) and ensuring data dependencies make sense (only storing related data in a table). Both of these are worthy goals, as they reduce the amount of space a database consumes and ensure that data is logically stored.",3
"1.Minimize Data Redundancy 
In File Processing System, duplicate data is created in many places because all the programs have their own files. This creates data redundancy which in turns wastes labor and space. In Database Management System, all the files are integrated in a single database. The whole data is stored only once at a single place so there is no chance of duplicate data.2.Sharing Of Data
In DBMS, Data can be shared in between authorized user of database. All the users have their own right to access the database up to a level. Database Administration has complete access of database. He can assign users to access the database. Others users are also authorized to access database and also they can share data between them. Many users have same authority to access the database.
Data Consistency
DBMS controls data redundancy which in turn controls data consistency. Data consistency means if you want to update data in any files then all the files should not be updated again. As in DBMS, data is stored in a single database so data becomes more consistent in comparison to file processing system. Also updated values are available to all the users immediately.",3
"A relational database is a type of database. It uses a structure that allows us to identify and access data in relation to another piece of data in the database. Often, data in a relational database is organized into tables. Tables can have hundreds, thousands, sometimes even millions of rows of data. These rows are often called records.A relational database management system (RDBMS) is a program that allows you to create, update, and administer a relational database. Most relational database management systems use the SQL language to access the database. ",3
"A Database Management system is not always directly available for users and applications to access and store data in it. A Database Management system can be centralised(all the data stored at one location), decentralised(multiple copies of database at different locations) or hierarchical, depending upon its architecture.",3.5
"1-tier DBMS architecture also exist, this is when the database is directly available to the user for using it to store data. Generally such a setup is used for local application development, where programmers communicate directly with the database for quick response.",3
"2-tier DBMS architecture includes an Application layer between the user and the DBMS, which is responsible to communicate the user's request to the database management system and then send the response from the DBMS to the user.

An application interface known as ODBC(Open Database Connectivity) provides an API that allow client side program to call the DBMS. Most DBMS vendors provide ODBC drivers for their DBMS.",3.5
"It is an extension of the 2-tier architecture. In the 2-tier architecture, we have an application layer which can be accessed programatically to perform various operations on the DBMS. The application generally understands the Database Access Language and processes end users requests to the DBMS.

In 3-tier architecture, an additional Presentation or GUI Layer is added, which provides a graphical user interface for the End user to interact with the DBMS.",3
the entire transaction takes place at once or doesnâ€™t happen at all. There is no midway i.e. transactions do not occur partially. Each transaction is considered as one unit and either runs to completion or is not executed at all.,3
Integrity constraints must be maintained so that the database is consistent before and after the transaction. It refers to the correctness of a database.,2
multiple transactions can occur concurrently without leading to the inconsistency of database state. Transactions occur independently without interference. Changes occurring in a particular transaction will not be visible to any other transaction until that particular change in that transaction is written to memory or has been committed. This property ensures that the execution of transactions concurrently will result in a state that is equivalent to a state achieved these were executed serially in some order.,3.5
"Once the transaction has completed execution, the updates and modifications to the database are stored in and written to disk and they persist even if a system failure occurs. These updates now become permanent and are stored in non-volatile memory. The effects of the transaction, thus, are never lost.",3
"Any transaction will be in this state during its execution. Once the transaction starts executing from the first instruction begin_transaction, the transaction will be considered in active state. During this state it performs operations READ and WRITE on some data items.",3
