answers,marks
"ER model stands for an Entity-Relationship model. It is a high-level data model. This model is used to define the data elements and relationship for a specified system.
It develops a conceptual design for the database. It also develops a very simple and easy to design view of data.
In ER modeling, the database structure is portrayed as a diagram called an entity-relationship diagram.",5
"Database normalization is used in a database management system (DBMS), specifically with relational databases, to decrease redundant information and therefore minimize data anomalies. Anomalies can occur from information that is poorly grouped or redundant and can cause a range of effects, such as incorrect data insertion or the deletion of a whole group of data. By using database normalization, these anomalies are avoided, and memory typically is freed up so that the database can function more efficiently. Normalization functions should be used periodically, about once a week, to keep the database fresh and free of unexpected problems.",5
"It has decreased the risk of data management, i.e., manipulation of data will not affect the core data.
Data consistency is maintained as it manages data in a central repository.
It provides better data quality, which enables organizations to establish data standards.
It is less costly because fewer vendors are required to handle the data sets.",5
"RDBMS stands for Relational Database Management System. RDBMS is the basis for SQL, and for all modern database systems like MS SQL Server, IBM DB2, Oracle, MySQL, and Microsoft Access.
A Relational database management system (RDBMS) is a database management system (DBMS) that is based on the relational model as introduced by E. F. Codd.",5
"The design of a DBMS depends on its architecture. It can be centralized or decentralized or hierarchical. The architecture of a DBMS can be seen as either single tier or multi-tier. An n-tier architecture divides the whole system into related but independent n modules, which can be independently modified, altered, changed, or replaced.",5
"In 1-tier architecture, the DBMS is the only entity where the user directly sits on the DBMS and uses it. Any changes done here will directly be done on the DBMS itself. It does not provide handy tools for end-users. Database designers and programmers normally prefer to use single-tier architecture.",5
"If the architecture of DBMS is 2-tier, then it must have an application through which the DBMS can be accessed. Programmers use 2-tier architecture where they access the DBMS by means of an application. Here the application tier is entirely independent of the database in terms of operation, design, and programming.",5
"A 3-tier architecture separates its tiers from each other based on the complexity of the users and how they use the data present in the database. It is the most widely used architecture to design a DBMS.Database (Data) Tier âˆ’ At this tier, the database resides along with its query processing languages. We also have the relations that define the data and their constraints at this level.
Application (Middle) Tier âˆ’ At this tier reside the application server and the programs that access the database. For a user, this application tier presents an abstracted view of the database. End-users are unaware of any existence of the database beyond the application. At the other end, the database tier is not aware of any other user beyond the application tier. Hence, the application layer sits in the middle and acts as a mediator between the end-user and the database.
User (Presentation) Tier âˆ’ End-users operate on this tier and they know nothing about any existence of the database beyond this layer. At this layer, multiple views of the database can be provided by the application. All views are generated by applications that reside in the application tier.",5
"This property states that a transaction must be treated as an atomic unit, that is, either all of its operations are executed or none. There must be no state in a database where a transaction is left partially completed. States should be defined either before the execution of the transaction or after the execution/abortion/failure of the transaction.",5
"The database must remain in a consistent state after any transaction. No transaction should have any adverse effect on the data residing in the database. If the database was in a consistent state before the execution of a transaction, it must remain consistent after the execution of the transaction as well.",5
"In a database system where more than one transaction are being executed simultaneously and in parallel, the property of isolation states that all the transactions will be carried out and executed as if it is the only transaction in the system. No transaction will affect the existence of any other transaction",5
"The database should be durable enough to hold all its latest updates even if the system fails or restarts. If a transaction updates a chunk of data in a database and commits, then the database will hold the modified data. If a transaction commits but the system fails before the data could be written on to the disk, then that data will be updated once the system springs back into action.",5
"The active state is the first state of every transaction. In this state, the transaction is being executed.
For example: Insertion or deletion or updating a record is done here. But all the records are still not saved to the database. ",5
"In the partially committed state, a transaction executes its final operation, but the data is still not saved to the database.
In the total mark calculation example, a final display of the total marks step is executed in this state.",5
"A transaction is said to be in a committed state if it executes all its operations successfully. In this state, all the effects are now permanently saved on the database system.",5
"If any of the checks made by the database recovery system fails, then the transaction is said to be in the failed state.
In the example of total mark calculation, if the database is not able to fire a query to fetch the marks, then the transaction will fail to execute.",5
If any of the checks fail and the transaction has reached a failed state then the database recovery system will make sure that the database is in its previous consistent state. If not then it will abort or roll back the transaction to bring the database into a consistent state.,5
"This database is based on the relational data model, which stores data in the form of rows(tuple) and columns(attributes), and together forms a table(relation)",5
t is the type of database that stores data at a centralized database system. It comforts the users to access the stored data from different locations through several applications. These applications contain the authentication process to let users access data securely.,5
" in distributed systems, data is distributed among different database systems of an organization. These database systems are connected via communication links. Such links help the end-users to access the data easily. ",5
NoSQL is a type of database that is used for storing a wide range of data sets. It is not a relational database as it stores data not only in tabular form but in several different ways.,5
The type of database that uses the object-based data model approach for storing data in the database system. The data is represented and stored as objects which are similar to the objects used in the object-oriented programming language.,5
"It is the type of database that stores data in the form of parent-children relationship nodes. Here, it organizes data in a tree-like structure.",5
"It is used for storing vast amounts of data in a graph-like structure. Most commonly, social networking websites use the graph database.",5
An operating system is a software that acts as an intermediary between the computer hardware and the computer user. It provides a user interface and manages hardware resources to enable the execution of software applications.,5
"The three types of operating systems are Windows, macOS, and Linux. Each has its own strengths and weaknesses, catering to different user preferences and needs.
",5
"Multitasking refers to the ability of an operating system to execute multiple tasks concurrently on a single processor, switching between them rapidly. On the other hand, multiprocessing involves the simultaneous execution of multiple processes on multiple processors, enhancing overall system performance.",5
"The kernel is the core of the operating system, responsible for managing hardware resources such as memory, CPU, and I/O devices. It provides a bridge between applications and the computer hardware, ensuring efficient communication.",5
"Virtual memory is a memory management technique that uses both RAM and a portion of a computer's hard drive to simulate a larger amount of RAM. Its purpose is to allow applications to use more memory than physically available, improving multitasking and overall system performance.",5
" The file system organizes data on storage devices, ensuring efficient storage, retrieval, and organization of files and directories.
storage, and retrieval of files and directories.",5
"
A 32-bit OS processes data in 32-bit chunks, while a 64-bit OS processes data in 64-bit chunks, enabling greater memory addressing and improved performance.
",5
"
  A process is an independent program in execution, comprising program code, data, and resources needed for execution in a computer system.",5
"  Deadlock occurs when two or more processes are unable to proceed because each is waiting for the other to release a resource, leading to a standstill.
",5
"  A device driver is a specialized program that allows the operating system to communicate with and control hardware devices, serving as a translator between the OS and the hardware.",5
"The CLI is a text-based interface where users interact with the operating system by entering commands. It provides direct control over the system, often used for scripting and automation.",5
"  The task manager monitors and manages running processes, system performance, and resource usage. It allows users to view and control applications and processes.
",5
"  System calls provide a way for applications to request services from the operating system, acting as an interface between user-level programs and the kernel.
",5
"  A shell is a command interpreter that allows users to interact with the operating system by entering commands. It interprets user commands and executes them.
",5
"  Time-sharing is a technique in operating systems where multiple users share the same system resources simultaneously, allowing each user to have dedicated time slices for executing their tasks.
",5
"  The registry in Windows is a centralized database that stores configuration settings and options for the operating system and applications. It plays a crucial role in system configuration and management.
",5
"  A thread is the smallest unit of execution within a process in an operating system. Multiple threads within a process share the same resources, allowing for parallel execution.
",5
"  The BIOS is a firmware that initializes and manages essential hardware components during the computer's startup process. It provides the basic instructions for the system to boot.
",5
"  A page file, also known as a swap file, is a reserved space on the hard drive used by the operating system to store temporary data when physical RAM is insufficient. It aids in extending virtual memory.
",5
"  A kernel panic is a critical error in the operating system's kernel that causes it to halt. It indicates a severe system issue, leading to a system crash and requiring a reboot.
",5
"  The ""chmod"" command changes file permissions in Unix/Linux. It uses symbols like + and - to add or remove permissions for users, groups, and others.
",5
"  A deadlock occurs when processes are unable to proceed because each is waiting for the other to release a resource. An example is the dining philosophers problem.
",5
"  A compiler translates the entire source code into machine code before execution, producing an executable file. An interpreter translates and executes code line by line.
",5
"  The kernel is the core of the operating system, managing hardware resources, process scheduling, and communication between software and hardware.
",5
"  Virtual memory allows the OS to use a portion of the hard drive as additional RAM when physical RAM is full, enhancing system performance by accommodating more data.
",5
"  OOP is a programming paradigm based on objects. Example language: Java.
",5
"  Database normalization reduces redundancy by organizing data efficiently. Example: Breaking a table into smaller ones.
",5
"  A linked list is a data structure where elements are connected. Example: Singly linked list.
",5
"  Agile is an iterative and incremental approach. Principles: Customer collaboration, responding to change, working software.
",5
"  Binary search is a divide-and-conquer algorithm. It's efficient, with a time complexity of O(log n).
",5
"  Cloud computing is delivering computing services over the internet. Advantages include scalability and cost-effectiveness.
",5
"A computer network is a system of interconnected computers and devices that can share data and resources. It's crucial in the modern world because it forms the backbone of the internet, enabling global communication, online services, and information sharing.",5
"The core components of a computer network are devices (computers, routers, switches), transmission media (wires or wireless signals), and network protocols that govern data communication.",5
"A LAN is a network that covers a small geographic area, like a home or office, connecting devices within that proximity. In contrast, a WAN spans larger distances, often across cities or even countries, connecting multiple LANs and facilitating global communication.",5
" Data transmission in a computer network involves breaking data into packets, which are then sent through the network. Key protocols include TCP (Transmission Control Protocol) for reliable data transfer and IP (Internet Protocol) for addressing and routing.",5
" The OSI (Open Systems Interconnection) model is a conceptual framework used to understand and standardize network communication. It consists of seven layers, each responsible for specific tasks in data transmission. It provides a common reference point for network engineers and helps ensure compatibility between different networking devices and protocols.",5
"A router is a network device that connects different networks and directs data between them, making it possible for devices on one network to communicate with those on another. A switch, on the other hand, connects devices within the same network and manages local traffic, allowing devices to communicate within a network.",5
" IP addresses are like digital postal addresses for devices on a network. They help in identifying and locating devices. IP addresses are structured in two formats: IPv4, which uses 32-bit addresses like 192.168.1.1, and IPv6, which uses 128-bit addresses",5
"Subnetting is the practice of dividing a large IP network into smaller, more manageable sub-networks. It's important in IP addressing because it helps optimize IP address usage, enhances network security, and allows for efficient network management",5
" IPv4 and IPv6 are both protocols used for addressing devices on a network, but they differ in address length. IPv4 uses 32-bit addresses, while IPv6 uses 128-bit addresses. IPv6 is becoming important due to the exhaustion of IPv4 addresses as more devices connect to the internet.",5
" DNS is like the internet's phone book. It translates human-readable domain names (e.g., www.example.com) into IP addresses (e.g., 203.0.113.1). DNS is essential because it simplifies internet navigation and ensures that we can access websites using easy-to-remember names.",5
"Security concerns in computer networks include data breaches, malware, and unauthorized access. These can be mitigated through encryption, regular software updates, strong access controls, and network monitoring.",5
"A VPN is a technology that creates a secure and encrypted connection over a public network, such as the internet. It's used to protect sensitive data and ensure privacy by establishing a private and secure tunnel for network communications, especially when accessing the internet from untrusted networks.",5
"TCP is a connection-oriented protocol that ensures reliable data delivery, making it suitable for applications like web browsing and email. UDP, on the other hand, is connectionless and ideal for real-time applications such as video streaming and online gaming, where slight data loss is acceptable.",5
"Wi-Fi allows devices to connect to a network wirelessly using radio waves. To secure wireless networks, encryption methods like WPA3 and WPA2 are employed. These methods protect data by encoding it during transmission, preventing unauthorized access.",5
" Network topologies define how devices are connected in a network. Examples of common topologies include the bus topology, where devices are connected in a linear fashion, the star topology with a central hub connecting devices, and the ring topology, where each device is connected to two others in a circular arrangement.",5
"A firewall is a network security device or software that acts as a barrier between a computer network and external threats. It monitors incoming and outgoing network traffic, filters data packets based on predefined rules, and blocks or allows traffic accordingly, thus protecting the network from unauthorized access and malicious activity.",5
"A network administrator is responsible for the maintenance, operation, and security of computer networks. They configure and monitor network devices, troubleshoot issues, ensure data backups, manage user accounts, and implement security measures such as firewalls and intrusion detection systems.",5
"Quality of Service (QoS) is a set of technologies and mechanisms that prioritize network traffic to ensure certain applications or data streams receive better performance. It is crucial in situations where real-time applications like VoIP, video conferencing, or online gaming require low latency and reliable data transmission.",5
"A packet-switched network divides data into packets that are independently routed from source to destination. It is more efficient and flexible compared to a circuit-switched network, where a dedicated communication path is established for the entire duration of a call. Packet-switched networks are commonly used for data transmission, while circuit-switched networks are traditional for voice calls.",5
"When designing a network for a large organization or data center, key considerations include scalability to accommodate growth, redundancy for fault tolerance, security measures like firewalls and intrusion detection, high-speed data connections, and efficient network management and monitoring tools.",5
"MAC addresses, or Media Access Control addresses, are unique hardware addresses assigned to network devices for local communication within a network. They differ from IP addresses as MAC addresses are physical and used for data link layer communication, while IP addresses are logical and operate at the network layer, facilitating global data routing.",5
Bandwidth in networking refers to the capacity of a network to transmit data. It impacts data transmission by determining how much data can be sent in a given time frame. Higher bandwidth allows for faster data transfer and supports activities like streaming and video conferencing.,5
"A proxy server is an intermediary server that acts as a gateway between a user's device and the internet. It plays a crucial role in network security and privacy by hiding the user's IP address and providing an additional layer of protection. It can also filter and cache content, making web browsing faster and more secure.",5
"A VLAN, or Virtual Local Area Network, is a logical segmentation of a physical network into multiple isolated networks. It is used in network design to enhance network efficiency, security, and manageability. VLANs allow different groups of devices to be on separate networks while still sharing the same physical infrastructure.",5
" Network routers and switches serve different purposes within a network. Routers are responsible for forwarding data between different networks, determining the best path for data to reach its destination. Switches, on the other hand, are used to connect devices within the same network, making sure data gets to the right device. Routers work at the network layer (Layer 3), while switches operate at the data link layer (Layer 2).",5
"Latency is a critical factor in network performance, especially for real-time applications like video conferencing and online gaming. High latency can cause delays and disrupt the real-time experience, leading to poor video quality and lag in online games. Low latency is essential for responsive and smooth interactions in such applications.",5
"Load balancing in network design involves distributing network traffic across multiple servers or paths to ensure even utilization and prevent overloading. The benefits include improved network performance, enhanced redundancy, and increased reliability. It also enables scalability as additional resources can be easily added.",5
" A DNS resolver is a component of the DNS (Domain Name System) that translates domain names into IP addresses. When a user enters a domain name in a web browser, the resolver queries DNS servers to find the corresponding IP address, allowing the device to connect to the desired website.",5
" Network administrators play a crucial role in managing and maintaining computer networks. Their tasks include configuring and monitoring network devices, troubleshooting connectivity issues, ensuring data backups, managing user accounts and permissions, and implementing security measures like firewalls and intrusion detection systems",5
" Quality of Service (QoS) significantly affects network performance by prioritizing certain types of network traffic. It is crucial in situations where real-time applications such as voice and video calls rely on low latency and consistent data delivery. QoS ensures that critical traffic receives priority treatment, guaranteeing a better user experience.",5
" A firewall is a network security device or software that acts as a barrier between a computer network and external threats. It monitors incoming and outgoing network traffic, filters data packets based on predefined rules, and blocks or allows traffic accordingly. By doing so, it protects the network from unauthorized access and malicious activity.",5
"Wi-Fi allows devices to connect to a network wirelessly using radio waves. To secure wireless networks, encryption methods like WPA3 and WPA2 are employed. These methods protect data by encoding it during transmission, preventing unauthorized access.",5
"When designing a network for a large organization or data center, key considerations include scalability to accommodate growth, redundancy for fault tolerance, security measures like firewalls and intrusion detection systems, high-speed data connections, and efficient network management and monitoring tools.",5
A subnet mask is a numeric code used in IP addressing to define network and host portions of an IP address. It affects IP address allocation by specifying which part of the address identifies the network and which part identifies the host. This allows for efficient use of IP addresses and network segmentation.,5
"A DMZ, or Demilitarized Zone, is a network segment located between an internal network and an external network like the internet. It's crucial in network security as it acts as a buffer, allowing services that need to be accessible from the internet, like web servers, while keeping the internal network protected. It adds an extra layer of defense against external threats.",5
"A Man-in-the-Middle (MitM) attack is a cyberattack where an attacker intercepts and potentially alters communication between two parties without their knowledge. It can be prevented by using encryption, digital certificates, and secure communication protocols, which make it harder for an attacker to eavesdrop or manipulate data.",5
"Network virtualization is the process of creating multiple virtual networks on a single physical network infrastructure. It offers several benefits for data centers and cloud computing, including improved resource utilization, agility, and isolation. Virtualization allows for the efficient use of network resources and enables seamless management and scaling of networks.",5
"A network protocol analyzer, also known as a packet sniffer, is a tool used to capture and inspect network traffic. It is valuable in network troubleshooting and monitoring to diagnose network issues, identify performance bottlenecks, and analyze network behavior. It helps administrators understand how data flows across the network and pinpoint problems.",5
" A network gateway serves as an entry and exit point for data between different network segments. It acts as a translator, facilitating communication between networks that use different protocols or addressing schemes. The gateway's significance lies in its ability to connect and bridge distinct network segments, allowing seamless data exchange.",5
