answers,marks
"Encapsulation ensures that the internal state of an object is only accessible through well-defined methods (getters and setters), allowing you to maintain control over how the data is accessed and modified. This prevents unauthorized or unintended changes to the data, helping maintain data integrity.",4
"Inheritance allows a class (subclass or derived class) to inherit properties and methods from another class (superclass or base class). This promotes code reuse and establishes an ""is-a"" relationship between the classes. For example, you can have a superclass Vehicle and a subclass Car, where Car inherits characteristics like speed and fuel from Vehicle.",4
"Advantages of inheritance include code reuse, modularity, and the ability to create hierarchies of related classes. It simplifies the design and maintenance of software by allowing common attributes and behaviors to be defined in a superclass and reused in subclasses.",5
"private' is an access modifier that restricts access to class members (attributes or methods) to within the same class. Members declared as 'private' can't be accessed or modified from outside the class, ensuring data encapsulation.",5
"Polymorphism is the ability of objects to take on multiple forms. In OOP, it can be achieved through method overriding or method overloading. For example, you can have a Shape class with a draw method, and subclasses like Circle and Rectangle that override the draw method to suit their specific shapes.",5
Abstract classes are classes that cannot be instantiated and serve as templates for other classes. They may contain abstract (unimplemented) methods that must be implemented by subclasses. They are used to define a common interface for a group of related classes.,4.5
"Method overloading is when a class has multiple methods with the same name but different parameter lists. The appropriate method is chosen at compile-time based on the number or type of arguments.
Method overriding is when a subclass provides a specific implementation of a method that is already defined in its superclass. The method in the subclass must have the same name, return type, and parameters as the method in the superclass.",4.5
"OOP supports code reusability through inheritance and composition. Inheritance allows the reuse of code by creating new classes based on existing classes, and composition involves creating classes that contain instances of other classes to reuse their functionality.",3.5
"Inheritance creates an ""is-a"" relationship between classes, while composition creates a ""has-a"" relationship. Inheritance promotes code reuse by inheriting attributes and methods, while composition involves creating objects of other classes and using them as components in a new class.",3.5
A constructor is a special method in a class that is called when an object of that class is created. Its role is to initialize the object's attributes or perform any necessary setup. Constructors have the same name as the class and may have parameters to accept initial values.,4.5
"A destructor is a special method used to clean up resources when an object is destroyed or goes out of scope. In some languages like C++, destructors are automatically called when the object's lifetime ends, and in others, like Python, it's managed by the garbage collector.",4.5
"Static methods and variables are associated with the class itself rather than instances of the class. Static methods can be called on the class, and static variables are shared among all instances of the class. They are often used for utility methods or constants.",4.5
The 'super' keyword is used to call methods or constructors from the superclass when you are in a subclass. It's typically used in cases of method overriding or when you want to extend the behavior of a superclass method in the subclass.,4.5
"The 'this' keyword refers to the current object within a class, allowing you to access its attributes and methods. It is used to disambiguate between instance variables and method parameters. 'super' is used to access members of the superclass. 'this' and 'super' serve different purposes.",3.5
"Multiple inheritance is a feature where a class can inherit from more than one class. The diamond problem occurs when a class inherits from two classes that have a common ancestor. It can lead to ambiguity in method resolution, and some programming languages like C++ and Python have mechanisms to handle it.",3.5
"SOLID is an acronym for a set of design principles in OOP:

Single Responsibility Principle (SRP): A class should have only one reason to change, meaning it should have a single responsibility.
Open-Closed Principle (OCP): Software entities (classes, modules, functions) should be open for extension but closed for modification.
Liskov Substitution Principle (LSP): Subtypes must be substitutable for their base types without altering the correctness of the program.
Interface Segregation Principle (ISP): Clients should not be forced to depend on interfaces they do not use.
Dependency Inversion Principle (DIP): High-level modules should not depend on low-level modules. Both should depend on abstractions. Abstractions should not depend on details. Details should depend on abstractions.",3
"An abstract class can have both implemented and abstract methods and can have attributes, whereas an interface only defines a contract for methods that implementing classes must provide. A class can inherit from one abstract class but implement multiple interfaces.",3
"Method chaining, also known as fluent interfaces, is a technique where you design methods that return the current object (usually 'this') so that multiple methods can be called sequentially on the same object. This results in more concise and readable code.",0
"OOP supports information hiding by using access modifiers like 'private,' 'protected,' and 'public' to control the visibility of class members. This restricts direct access to data and allows you to expose only the necessary methods and attributes to the outside world.",4.5
"A shallow copy duplicates the top-level structure of an object but references the same objects that are contained within. Changes to the contained objects affect both the original and the copied object.
A deep copy creates a completely independent duplicate, including all the objects contained within the original. Changes to the copied object do not affect the original.",4.5
"A design pattern is a reusable and general solution to a common problem in software design. They provide best practices and templates for solving recurring design issues, making code more maintainable and easier to understand.",4.5
"The Observer pattern defines a one-to-many relationship between objects. When one object (the subject) changes its state, all its dependents (observers) are notified and updated automatically. A real-world example is a news subscription, where subscribers are notified when new articles are published.",3.5
"The Singleton pattern ensures that a class has only one instance and provides a global point of access to that instance. It is useful when you want to restrict the instantiation of a class to a single object, like a configuration manager or a connection pool.",3.5
"The Factory Method pattern defines an interface for creating objects but allows subclasses to alter the type of objects that will be created. It's used when a class cannot anticipate the type of objects it needs to create, and this decision should be left to its subclasses.",3.5
"The 'final' keyword is used to restrict the further extension or overriding of a class, method, or variable. In class definitions, it can be used to indicate that a class cannot be subclassed. In method definitions, it prevents the method from being overridden in derived classes, and in variable definitions, it makes the variable a constant that cannot be changed once initialized.",3.5
"In OOP, the ""superclass"" and ""subclass"" relationship refers to inheritance. The superclass, also known as the base class or parent class, is a class that provides attributes and methods to its subclasses. Subclasses, also called derived classes or child classes, inherit these attributes and methods from the superclass. This relationship allows subclasses to reuse and extend the functionality of the superclass, establishing an ""is-a"" relationship.",3.5
"""Polymorphism"" in OOP refers to the ability of different classes to be treated as objects of a common base class. It allows a single piece of code to work with objects of various subclasses. For example, a method that operates on a base class can be used with different derived classes. Polymorphism ensures that the most appropriate method is executed based on the actual object's type, promoting code reusability and flexibility.",4
"OOP handles ""method overriding"" when a subclass provides its own implementation of a method that is already defined in its superclass. This allows the subclass to customize the behavior of the inherited method. Method overriding is useful when you want to create more specialized behavior in the subclass while maintaining a consistent method signature. It enables polymorphism and ensures that objects of different classes can be treated uniformly.",4
"""Interfaces"" in OOP define a contract specifying a set of method signatures that implementing classes must adhere to. They provide a way to achieve multiple inheritance in Java. Interfaces are important for achieving abstraction and code reusability by allowing unrelated classes to share a common set of methods without the need for a common base class. Unlike abstract classes, interfaces only define method signatures, not their implementations.",4
"""Method visibility"" in OOP determines who can access and call methods. In OOP, there are three primary visibility levels:

""Public"" methods are accessible from anywhere in the program.
""Private"" methods are only accessible within the class that defines them.
""Protected"" methods are accessible within the class and its subclasses.",4
"A ""constructor"" in OOP is a special method responsible for initializing an object when it's created. Constructors have the same name as the class and do not have a return type. They are called automatically when an object is instantiated and can be used to set initial values for the object's attributes.",4
"OOP handles ""multiple inheritance"" by allowing a class to inherit from multiple superclasses. Multiple inheritance poses challenges in some programming languages, leading to the ""diamond problem."" Some languages, like Java, allow multiple interface inheritance but prevent multiple class inheritance. This limitation is a solution to avoid ambiguities in method resolution.",3.5
"""Aggregation"" and ""composition"" are concepts in OOP for creating classes by combining or composing objects of other classes as attributes. In aggregation, objects have a ""has-a"" relationship, where they can exist independently. In composition, one class is composed of objects of other classes, and they have a stronger ""whole-part"" relationship. Composition implies that the lifetime of the composed objects is controlled by the containing object.",3
"""Method chaining"" is a technique in OOP where a series of method calls is chained together in a single statement. It improves code readability and design by allowing for a more fluent and concise way to interact with objects. Method chaining is often used when multiple methods return the same object, allowing you to call them one after another in a chain.",3
"""Tight coupling"" and ""loose coupling"" refer to the degree of interdependence between classes in a software system. ""Tight coupling"" implies strong dependencies between classes, making it harder to modify or extend the system without affecting other parts. ""Loose coupling"" indicates weaker dependencies, where classes interact through well-defined interfaces, making the system more flexible, maintainable, and easier to change. Loose coupling is a key principle in achieving good software design.",3
"An Entity Relationship (ER) Diagram is a type of flowchart that illustrates how â€œentitiesâ€ such as people, objects or concepts relate to each other within a system. ER Diagrams are most often used to design or debug relational databases in the fields of software engineering, business information systems, education and research. Also known as ERDs or ER Models, they use a defined set of symbols such as rectangles, diamonds, ovals and connecting lines to depict the interconnectedness of entities, relationships and their attributes. They mirror grammatical structure, with entities as nouns and relationships as verbs.",3
"Normalization is a database design technique which organizes tables in a manner that reduces redundancy and dependency of data. 
It divides larger tables to smaller tables and links them using relationships. Normalization means split the tables into small tables which will contain less number of attributes in such a way that table design must not contain any problem of inserting, deleting, updating anomalies and guarantees no redundancy.",3.4
"1. Improved data sharing
Â 
An advantage of the database management approach is, the DBMS helps to create an environment in which end users have better access to more and better-managed data. 
Such access makes it possible for end users to respond quickly to changes in their environment.
Â 
2. Improved data security
Â 
The more users access the data, the greater the risks of data security breaches. Corporations invest considerable amounts of time, effort, and money to ensure that corporate data are used properly. A DBMS provides a framework for better enforcement of data privacy and security policies.
Â  
3. Better data integration
Â 
Wider access to well-managed data promotes an integrated view of the organizationâ€™s operations and a clearer view of the big picture. It becomes much easier to see how actions in one segment of the company affect other segments.",3.5
"RDBMS full form is for Relational Database Management System. It arranges information into allied rows and columns.
Basic Features of RDMS:
Offers information to be saved in the tables
Numerous users can access it together which is managed by a single user
Virtual tables are available for storing the insightful data
In order to exclusively find out the rows, the primary key is used
The data are always saved in rows and columns
To retrieve the information the indexes are used
Columns are being shared between tables using the keys",3.5
"DBMS architecture helps in design, development, implementation, and maintenance of a database. A database stores critical information for a business. Selecting the correct Database Architecture helps in quick and secure access to this data.",3.5
"The simplest of Database Architecture are 1 tier where the Client, Server, and Database all reside on the same machine. Anytime you install a DB in your system and access it to practise SQL queries it is 1 tier architecture. But such architecture is rarely used in production.",3.5
"A two-tier architecture is a database architecture where

Presentation layer runs on a client (PC, Mobile, Tablet, etc)
Data is stored on a Server.
An application interface which is called ODBC (Open Database Connectivity) an API which allows the client-side program to call the DBMS. Today most of the DBMS offers ODBC drivers for their DBMS. 2 tier architecture provides added security to the DBMS as it is not exposed to the end user directly.

Example of Two-tier Architecture is a Contact Management System created using MS- Access.",3.5
"This DBMS architecture contains an Application layer between the user and the DBMS, which is responsible for communicating the user's request to the DBMS system and send the response from the DBMS to the user.

The application layer(business logic layer) also processes functional logic, constraint, and rules before passing data to the user or down to the DBMS

Three tier architecture is the most popular DBMS architecture.",3.5
"A transaction is an atomic unit; hence, all the instructions within a transaction will successfully execute, or none of them will execute. If any of the instructions fail, the entire transaction should abort and rollback.",3.5
"A database is initially in a consistent state, and it should remain consistent after every transaction. ",2
"If the multiple transactions are running concurrently, they should not be affected by each other; i.e., the result should be the same as the result obtained if the transactions were running sequentially. ",2.5
,0
"This is the first state of transaction and here the transaction is being executed. For example, updating or inserting or deleting a record is done here. But it is still not saved to the database. When we say transaction it will have set of small steps, and those steps will be executed here.",3.5
This is also an execution phase where last step in the transaction is executed. But data is still not saved to the database.,3.5
,0
"If a transaction cannot proceed to the execution state because of the failure of the system or database, then the transaction is said to be in failed state. ",3
"If a transaction is failed to execute, then the database recovery system will make sure that the database is in its previous consistent state. If not, it brings the database to consistent state by aborting or rolling back the transaction. If the transaction fails in the middle of the transaction, all the executed transactions are rolled back to it consistent state before executing the transaction. ",3
"Relational databases organize data using tables. Tables are structures that impose a schema on the records that they hold. Each column within a table has a name and a data type. Each row represents an individual record or data item within the table, which contains values for each of the columns. Relational databases get their name from mathematical relationships that use tuples (like the rows in a table) to represent ordered sets of data.",3
,0
,0
NoSQL is a term for a varied collection of modern database types that offer approaches that differ from the standard relational pattern.,2.5
,0
Hierarchical databases were the next evolution in database management development. They encode a relationship between items where every record has a single parent. This builds a tree-like structure that can be used to categorize records according to their parent record.,2
"Graph databases are a type of NoSQL database that takes a different approach to establishing relationships between data. Rather than mapping relationships with tables and foreign keys, graph databases establish connections using the concepts of nodes, edges, and properties.",2.5
"The operating system is like a traffic controller for a computer. It organizes and directs the flow of data and instructions, ensuring that different software and hardware components work together seamlessly.",3
,0
"Multitasking is like a chef juggling between various dishes in the kitchen, doing a little of each simultaneously. Multiprocessing is having multiple chefs, each independently preparing a different dish, making the overall cooking process faster.",3.5
"The kernel is like the conductor of an orchestra, coordinating various components to create a harmonious performance. It manages processes, allocates resources, and handles communication between software and hardware, ensuring a well-orchestrated computing experience.",3
"Virtual memory acts as a supplement to physical RAM by using a dedicated portion of the hard drive. It allows the operating system to swap data between RAM and the hard drive, optimizing the use of available memory and supporting the execution of complex applications.",3.5
"It facilitates the storage and retrieval of data on storage devices, maintaining the structure and organization of files and directories.
",3.5
"The primary difference is in how much data the CPU can handle at once. A 32-bit OS processes data in 32-bit units, and a 64-bit OS processes data in 64-bit units, allowing for greater memory capacity.
  32-bit systems process data in 32-bit chunks, while 64-bit systems handle data in 64-bit chunks. This affects memory addressing capabilities and overall system performance.",3.5
"  In the realm of operating systems, a process is an instance of a program in execution, containing code, data, and system resources.
",3
"
  It is a scenario in operating systems where multiple processes are unable to proceed because each is waiting for the other to release a resource, causing a standstill.",3.5
"
  It is a program that enables the operating system to communicate with and control hardware devices, ensuring proper interaction and functionality.",3
"
  In operating systems, the CLI is a text-based interface that allows users to issue commands directly to the system. It is often preferred for its efficiency and scripting capabilities.",4
"  Task manager plays a crucial role in operating systems by monitoring processes, resource usage, and overall system performance. It provides a user interface to manage and control running applications.
",3.5
"  The role of a system call in operating systems is to provide an interface for applications to request services from the kernel, such as file operations or memory allocation.
",3.5
"  A shell is a user interface in operating systems that interprets and executes user commands, acting as an intermediary between users and the operating system.
",2
"  Time-sharing is a strategy in operating systems where multiple users share the system resources by dividing time into slices, providing each user with a turn to execute their tasks.
",4
"  In Windows, the registry is a centralized database that stores configuration settings and preferences for the operating system and applications. It is essential for maintaining system integrity and customization.
",4
"  In the context of operating systems, a thread is the smallest unit of execution within a process. Multiple threads within a process can run concurrently, sharing the same resources.
",3.5
"  BIOS, or Basic Input/Output System, is firmware that initializes hardware components during a computer's startup. It provides essential instructions for the system to begin the boot process.
",2
"  A page file, within the context of virtual memory, is a reserved area on the storage device used by the operating system to swap data between physical RAM and the hard drive, optimizing memory usage.
",4
"  In the context of operating systems, a kernel panic is a situation where the kernel encounters a critical error, causing the system to halt. It requires a restart to recover from the error.
",5
"  In Unix/Linux, ""chmod"" changes file permissions. You can use it to give or revoke permissions for users, groups, and others using symbolic notation or numeric codes.
",4
"  A deadlock is a scenario where processes are stuck because each is waiting for a resource held by another. An example is two processes needing exclusive access to the same file.
",3
"  In programming, a compiler converts the entire source code into machine code, resulting in an executable file. An interpreter interprets and executes the code line by line without producing a separate executable.
",3
"In operating systems, the kernel is the essential part that manages hardware resources, process scheduling, and acts as an intermediary between software and hardware.
",4
"  In computer systems, virtual memory extends the available RAM by using part of the hard drive, enabling the system to handle larger applications and data sets more efficiently.
",4
"  In OOP, code is structured using objects. Example language: C++.
",4
"  It's a method to organize data in a database, reducing redundancy. Example: Creating separate tables for distinct data.
",5
"  Linked list is a data structure with connected elements. Example: Singly linked list with nodes.
",5
"  Agile is an iterative software development approach. Principles: Responding to change, collaboration, delivering working software.
",4
"  It's a logarithmic search algorithm, efficient for sorted data.
",5
"  It's delivering computing services via the internet. Advantages include flexibility and cost savings.
",4.5
,0
"In a computer network, you have devices (computers, switches, and routers), data transmission mediums (cables or Wi-Fi), and communication rules (protocols) that ensure data can be shared and accessed.",4.5
"LANs are localized networks used within homes, offices, or campuses to connect devices within a limited area. In contrast, WANs are expansive networks that connect LANs over long distances, enabling global communication and internet access.",5
" In computer networks, data is divided into packets for transmission. Key protocols include TCP for error-checking and reliable data delivery and IP for addressing and routing packets to their intended destination.",5
" The OSI model is a framework that breaks down network communication into seven distinct layers, each with its specific function. This model helps network professionals understand and troubleshoot network issues more effectively by isolating problems to a particular layer.",5
" Routers link different networks together and make decisions about where data should go based on network addresses. They operate at the network layer. Switches, however, connect devices within the same network and use MAC addresses to forward data within that network, working at the data link layer.",5
" IP addresses are crucial for identifying and locating devices on a network. They come in two formats: IPv4, using 32-bit addresses like 192.168.1.1, and IPv6, with 128-bit addresses",4
